{
  "version": "1.0.0",
  "name": "aws-infrastructure-decision-rules",
  "description": "Machine-readable rules for deriving AWS architecture recommendations and Terraform generation prerequisites from structured user input.",
  "source": {
    "report": "AWS Infrastructure Decision Utility for Terraform Generation.pdf",
    "generated_on": "2026-04-19"
  },
  "input_contract": {
    "workload": {
      "app_type": ["static_site", "public_api", "web_app", "worker", "event_processor", "internal_app", "batch_job"],
      "packaging": ["source_only", "function", "container", "vm"],
      "runtime": ["node", "python", "java", "go", "dotnet", "other"],
      "statefulness": ["stateless", "session_state", "shared_files", "stateful_service"],
      "request_pattern": ["synchronous", "asynchronous", "mixed"],
      "max_execution_time": ["short_under_15m", "long_running"],
      "environments": ["dev", "staging", "prod"],
      "single_tenant_or_multi_tenant": ["single", "multi"]
    },
    "traffic": {
      "internet_exposed": ["yes", "no"],
      "global_users": ["yes", "no"],
      "estimated_rps": "integer",
      "traffic_variability": ["steady", "diurnal", "spiky", "unpredictable"],
      "websocket_or_streaming": ["yes", "no"],
      "latency_sensitivity": ["low", "medium", "high"]
    },
    "data": {
      "primary_data_model": ["none", "key_value", "document", "relational", "object", "file", "cache"],
      "relational_features_needed": ["joins", "transactions", "reporting", "none"],
      "read_write_profile": ["read_heavy", "write_heavy", "balanced"],
      "data_retention": ["short", "medium", "long"],
      "backups_required": ["yes", "no"],
      "disaster_recovery_tier": ["none", "in_region_ha", "cross_region"]
    },
    "security_and_compliance": {
      "data_sensitivity": ["public", "internal", "confidential", "regulated"],
      "compliance": ["none", "soc2_like", "hipaa_like", "pci_like", "custom"],
      "encryption_customer_managed": ["yes", "no"],
      "public_access_exceptions": ["none", "approved_public_s3", "public_api", "public_alb"],
      "secret_types": ["none", "app_secrets", "db_credentials", "api_keys"],
      "human_access_model": ["console_ok", "federated_only", "break_glass_only"]
    },
    "networking": {
      "needs_vpc_private_resources": ["yes", "no"],
      "outbound_internet_needed_from_private": ["yes", "no"],
      "private_connectivity_only": ["yes", "no"],
      "on_prem_or_other_vpc_connectivity": ["yes", "no"]
    },
    "operations": {
      "team_ops_maturity": ["low", "medium", "high"],
      "logs_and_metrics_required": ["baseline", "enhanced", "audit_grade"],
      "change_frequency": ["low", "medium", "high"]
    },
    "cost": {
      "monthly_budget_band": ["minimal", "constrained", "moderate", "flexible"],
      "cost_priority": ["lowest_possible", "balanced", "performance_first"],
      "commitment_ok": ["none", "savings_plans_ok", "spot_ok"]
    }
  },
  "required_blockers": [
    "traffic.internet_exposed",
    "workload.environments",
    "security_and_compliance.data_sensitivity",
    "data.primary_data_model",
    "data.backups_required",
    "cost.monthly_budget_band"
  ],
  "intermediate_architecture_spec": [
    "compute_plane",
    "ingress_plane",
    "data_plane",
    "network_plane",
    "security_baseline",
    "observability_baseline",
    "cost_control_baseline"
  ],
  "recommendation_output_contract": {
    "architecture_summary": "object",
    "required_resources": "array",
    "optional_resources": "array",
    "security_controls": "array",
    "cost_controls": "array",
    "risks": "array",
    "assumptions": "array",
    "terraform_modules": "array",
    "unresolved_questions": "array"
  },
  "service_catalog": {
    "compute": ["lambda", "ecs_fargate", "ec2"],
    "ingress": ["apigw_http_api", "apigw_rest_api", "alb", "cloudfront"],
    "data": ["dynamodb", "rds", "aurora", "s3", "efs", "elasticache"],
    "async": ["sqs", "eventbridge", "step_functions"],
    "security": ["iam", "kms", "secrets_manager", "cloudtrail", "config", "guardduty", "security_hub", "waf", "access_analyzer", "backup", "inspector"],
    "ops_and_cost": ["cloudwatch", "budgets", "cost_anomaly_detection", "compute_optimizer"]
  },
  "rules": {
    "compute": [
      {
        "id": "compute_lambda_default",
        "priority": 100,
        "when_all": [
          { "path": "workload.request_pattern", "in": ["synchronous", "asynchronous", "mixed"] },
          { "path": "workload.max_execution_time", "equals": "short_under_15m" },
          { "path": "workload.statefulness", "equals": "stateless" },
          { "path": "traffic.traffic_variability", "in": ["spiky", "unpredictable"] },
          { "path": "operations.team_ops_maturity", "in": ["low", "medium"] },
          { "path": "workload.packaging", "in": ["source_only", "function"] }
        ],
        "select": {
          "compute_plane": "lambda",
          "required_resources": ["lambda", "iam_execution_role", "cloudwatch_log_group"]
        },
        "notes": ["Use Lambda for event-driven or request-driven, short-lived, mostly stateless workloads."]
      },
      {
        "id": "compute_ecs_fargate_default",
        "priority": 90,
        "when_any": [
          { "path": "workload.packaging", "equals": "container" },
          { "path": "workload.max_execution_time", "equals": "long_running" },
          { "path": "workload.statefulness", "in": ["session_state", "shared_files"] }
        ],
        "select": {
          "compute_plane": "ecs_fargate",
          "required_resources": ["ecr", "ecs_cluster", "ecs_task_definition", "ecs_service", "iam_task_role", "iam_execution_role", "cloudwatch_log_group"]
        },
        "notes": ["Use ECS on Fargate for managed containers and long-running application processes."]
      },
      {
        "id": "compute_ec2_explicit_control",
        "priority": 80,
        "when_any": [
          { "path": "workload.packaging", "equals": "vm" },
          { "path": "operations.team_ops_maturity", "equals": "high" }
        ],
        "requires_assumption": "Workload requires OS-level control, custom agents, unusual networking, or licensing-specific infrastructure.",
        "select": {
          "compute_plane": "ec2",
          "required_resources": ["launch_template", "autoscaling_group", "iam_instance_profile", "cloudwatch_log_group", "systems_manager_access"]
        }
      },
      {
        "id": "compute_public_api_gateway_lambda_bundle",
        "priority": 95,
        "when_all": [
          { "path": "workload.app_type", "equals": "public_api" },
          { "path": "workload.max_execution_time", "equals": "short_under_15m" },
          { "path": "workload.packaging", "in": ["source_only", "function"] }
        ],
        "append_required_resources": ["apigw_http_api", "route53_optional", "custom_domain_optional"]
      },
      {
        "id": "compute_async_lambda_bundle",
        "priority": 70,
        "when_any": [
          { "path": "workload.app_type", "in": ["worker", "event_processor", "batch_job"] },
          { "path": "workload.request_pattern", "equals": "asynchronous" }
        ],
        "append_optional_resources": ["sqs", "eventbridge", "step_functions"]
      }
    ],
    "data": [
      {
        "id": "data_dynamodb_default",
        "priority": 100,
        "when_all": [
          { "path": "data.primary_data_model", "in": ["key_value", "document"] },
          { "path": "data.relational_features_needed", "equals": "none" }
        ],
        "select": {
          "data_plane": "dynamodb",
          "required_resources": ["dynamodb_table"]
        },
        "append_optional_resources": ["dynamodb_gsi", "dynamodb_streams"],
        "notes": ["Choose DynamoDB when joins are not required and access patterns can be defined explicitly."]
      },
      {
        "id": "data_relational_default",
        "priority": 95,
        "when_any": [
          { "path": "data.primary_data_model", "equals": "relational" },
          { "path": "data.relational_features_needed", "in": ["joins", "transactions", "reporting"] }
        ],
        "select": {
          "data_plane": "rds_or_aurora",
          "required_resources": ["db_subnet_group", "db_security_group", "db_instance_or_cluster", "secrets_manager_secret"]
        },
        "notes": ["Choose RDS or Aurora when SQL, joins, transactions, or reporting requirements are present."]
      },
      {
        "id": "data_rds_lambda_proxy",
        "priority": 85,
        "when_all": [
          { "path": "data.primary_data_model", "equals": "relational" },
          { "path": "workload.max_execution_time", "equals": "short_under_15m" }
        ],
        "append_required_resources": ["rds_proxy"]
      },
      {
        "id": "data_s3_default",
        "priority": 90,
        "when_any": [
          { "path": "data.primary_data_model", "equals": "object" },
          { "path": "workload.app_type", "equals": "static_site" },
          { "path": "workload.statefulness", "equals": "shared_files" }
        ],
        "append_required_resources": ["s3_bucket"]
      },
      {
        "id": "data_efs_explicit",
        "priority": 60,
        "when_all": [
          { "path": "data.primary_data_model", "equals": "file" },
          { "path": "workload.statefulness", "equals": "shared_files" }
        ],
        "append_required_resources": ["efs_file_system", "efs_mount_targets"]
      },
      {
        "id": "data_cache_explicit",
        "priority": 60,
        "when_any": [
          { "path": "data.primary_data_model", "equals": "cache" },
          { "path": "data.read_write_profile", "equals": "read_heavy" }
        ],
        "append_optional_resources": ["elasticache_cluster"]
      }
    ],
    "ingress": [
      {
        "id": "ingress_static_site",
        "priority": 100,
        "when_all": [
          { "path": "workload.app_type", "equals": "static_site" }
        ],